title,description,show_type,tags,year,length,rating,votes,countries,link,image_link
Szmuglerzy / Smugglers / Milsu (2023),"Film akcji kryminalny osadzony w latach 70. w małej, spokojnej wiosce nad morzem, gdzie dwie kobiety niespodziewanie wciągają się w niebezpieczny przemyt.",Film,"Akcja, Kryminał",2023,129,6.4,96,,https://cda-hd.cc/64117/szmuglerzy-smugglers-milsu-2023/,https://image.tmdb.org/t/p/w185/ayLXqPZCu3uaLLhXiqvw5NBb7Lw.jpg
"Chłopiec, kret, lis i koń / The Boy, the Mole, the Fox and the Horse (2022)","Obejrzyj tworzenie się nietypowej więzi pomiędzy czwórką przyjaciół, którzy odkrywają znaczenie dobroci, odwagi i nadziei.",Film,"Animacja, Dramat, Familijny, Fantasy, Komedia, Przygodowy",2022,32,7.9,98,,https://cda-hd.cc/63256/chlopiec-kret-lis-i-kon-the-boy-the-mole-the-fox-and-the-horse-2022/,https://image.tmdb.org/t/p/w185/6yuC3zGT8TLykQuAmisGVMG6Rmz.jpg
Wyznawca 2 / Believer 2 / Dokjeon 2 (2023),"Zdeterminowany detektyw nie ustaje w poszukiwaniu prawdy o największym gangu narkotykowym w Azji i jego nieuchwytnym szefie, z którym ma rachunki do wyrównania.",Film,"Akcja, Kryminał, Thriller",2023,114,8.5,99,,https://cda-hd.cc/63148/wyznawca-2-believer-2-dokjeon-2-2023/,https://image.tmdb.org/t/p/w185/r6cXwZ4znjaz144TvVWIdTN8C9L.jpg
Jedź dziesiątką / Take the 10 (2017),"Dwóch kumpli znudzonych pracą na kasie przeżywa szereg niesamowitych przygód, by wybrać się na najlepszy koncert hip-hopowy ich życia.",Film,Komedia,2017,,6.8,8,USA,https://cda-hd.cc/10933/jedz-dziesiatka-take-the-10-2017-online/,https://image.tmdb.org/t/p/w185/jI5XSud40IeXOxIZvHZwtUND8HV.jpg
Zaproszenie na morderstwo / A Deadly Invitation (2023),Miłośniczka historii kryminalnych zostaje wplątana w sprawę morderstwa siostry i musi wskazać sprawcę spośród zebranych w willi gości z wyższych sfer.,Film,"Komedia, Tajemnica, Thriller",2023,92,5.5,81,,https://cda-hd.cc/62634/zaproszenie-na-morderstwo-a-deadly-invitation-2023/,https://image.tmdb.org/t/p/w185/ykDai0f894WQ9ayoNQeo67Wp6qk.jpg
Serce w chmurach / Love at First Sight (2023),"Hadley i Oliver zakochują się w sobie podczas lotu z Nowego Jorku do Londynu, ale na lotnisku tracą się z oczu. Czy uda im się znów spotkać?",Film,"Dramat, Romans",2023,90,7.0,94,,https://cda-hd.cc/62425/serce-w-chmurach-love-at-first-sight-2023/,https://image.tmdb.org/t/p/w185/vCMGlarDrcmhclBmnYoH7JUCDuA.jpg
Biblia / The Bible: In the Beginning… (1966),"Ten zrealizowany z ogromnym rozmachem film ukazuje pradzieje ludzkości poczynając od kosmicznego chaosu poprzez dzieło stworzenia, od stanu szczęścia poprzez upadek pierwszych rodziców, zbrodnię Kaina, historię Noego (John Huston), Potop i budowę Wieży Babel, aż po historię patriarchy Abrahama.",Film,"Dramat, Familijny",1966,,6.3,91,,https://cda-hd.cc/62185/biblia-the-bible-in-the-beginning-1966/,https://image.tmdb.org/t/p/w185/8Vqf5YXCBj2mE1TX4pegWAad4Gw.jpg
Bo się boi / Beau Is Afraid (2023),"Znerwicowany Beau otrzymuje wiadomość, która zmusza go do wyruszenia w epicką podróż do rodzinnego domu.",Film,"Dramat, Horror, Komedia",2023,,6.5,93,"USA, UK, Finland, Canada",https://cda-hd.cc/62005/bo-sie-boi-beau-is-afraid-2023/,https://image.tmdb.org/t/p/w185/ptEb9AuwWQMVp6zcAQSf3WIsD9z.jpg
Moda na miłość / The Perfect Find (2023),"Redaktorka magazynu o modzie wraca do pracy i odkrywa, że czarujący facet, z którym całowała się na imprezie, jest jej nowym współpracownikiem oraz synem jej szefa.",Film,"Dramat, Komedia, Romans",2023,99,5.3,90,,https://cda-hd.cc/61442/moda-na-milosc-the-perfect-find-2023/,https://image.tmdb.org/t/p/w185/fZXturIugHYCl7T6oLeMj1AWm7p.jpg
The Cursed (2021),"Pod koniec XIX wieku mężczyzna przybywa do odległej wioski, aby zbadać atak dzikiego zwierzęcia, ale odkrywa znacznie głębszą i złowrogą siłę, która terroryzuje dwór i jego mieszkańców.",Film,"Fantasy, Horror, Tajemnica",2021,,6.3,12281,"UK, France, USA",https://cda-hd.cc/60142/the-cursed-2021/,https://image.tmdb.org/t/p/w185/rYobaxr1JHhmOSszqQh5Aj4Viiu.jpg
Wendell i Wild / Wendell & Wild (2022),"Dwa podstępne demony zawierają pakt z nastoletnią fanką punk rocka, żeby opuścić zaświaty i spełniać marzenia w świecie żywych.",Film,"Animacja, Familijny, Fantasy, Komedia, Przygodowy",2022,,6.4,9125,,https://cda-hd.cc/59452/wendell-i-wild-wendell-wild-2022-online/,https://image.tmdb.org/t/p/w185/5dsX6UAHqkQz1kiV8bs8SvjyVNa.jpg
Agent Game (2022),Agent CIA zostaje wrobiony w zabójstwo. Musi uciekać przed ścigającym go zespołem pod wodzą bezwzględnej podwójnej agentki.,Film,"Akcja, Thriller",2022,90,3.9,1682,,https://cda-hd.cc/58259/agent-game-2022-online/,https://image.tmdb.org/t/p/w185/vWUaDeA0MgL750xFaUc3bzXgwtK.jpg
Fullmetal Alchemist the Revenge of Scar (2022),W tej kontynuacji pierwszego filmu bracia Elric spotykają najtrudniejszego z dotychczasowych przeciwników – seryjnego mordercę z wielką blizną na czole.,Film,"Akcja, Fantasy, Przygodowy",2022,,5.3,353,Japan,https://cda-hd.cc/57394/fullmetal-alchemist-the-revenge-of-scar-2022/,https://image.tmdb.org/t/p/w185/yTSqYT12q5A9WT0ju9pyHfuiIWi.jpg
Batman / The Batman (2022),Batman i James Gordon stawiają czoła nieobliczalnemu Człowiekowi-Zagadce w skorumpowanym Gotham City.,Film,"Akcja, Dramat, Kryminał, Tajemnica",2022,176,7.7,92,,https://cda-hd.cc/56131/batman-the-batman-2022-online/,https://image.tmdb.org/t/p/w185/lGzesThPVrXijebOF2TQN0z92gZ.jpg
Ju-on: The Final Curse / Ju-on: Za fainaru (2015),,Film,Horror,2015,90,4.4,866,Japan,https://cda-hd.cc/55849/ju-on-the-final-curse-ju-on-za-fainaru-2015-online/,https://image.tmdb.org/t/p/w185/rydIKTsG6bRWOBaRE44QU1rQBRi.jpg
Na cztery ręce / Four Hands / Die Vierhändige (2017),"W odizolowanym domku na wzgórzu dwie dziewczynki grają razem na pianinie. Kiedy ich matka wbiega przerażona do pokoju błagając napastnika o życie, siostry chowają się pod sofą. Stamtąd starsza z córek widzi krwawe, brutalne morderstwo, zasłaniając młodszej uszy i oczy, szepcząc, że ją ochroni.",Film,"Dramat, Thriller",2017,,6.1,582,Germany,https://cda-hd.cc/31172/na-cztery-rece-four-hands-2017-online/,https://image.tmdb.org/t/p/w185/royswZqbLgTP45ReP8B5jFROd0f.jpg
Kierowca / Wheelman (2017),"Po nie do końca udanej próbie napadu kierowca ucieka z łupem. Nagle otrzymuje szokujące instrukcje od nieznanej osoby — i będzie musiał pokazać, na co naprawdę go stać.",Film,"Akcja, Thriller",2017,,6.6,571,USA,https://cda-hd.cc/21299/kierowca-wheelman-2017-online/,https://image.tmdb.org/t/p/w185/yeHRsKOlNDsbEIALS1ve6S42Nl6.jpg
Zgubiłam Alberta / I Lost Albert Original / J’ai perdu Albert (2018),"Chloe (Julie Ferrier) może pochwalić się błyskotliwą karierą mediatorki zatrudnianej w ważnych firmach. Z jej usług korzystają nawet politycy. Te liczne sukcesy nie wzięły się jednak znikąd. Od czasów dzieciństwa w jej mózgu mieszka sam Albert Einstein (Etienne Draber), który kieruje jej działaniami. Niestety, naukowiec ma już dość współpracy z Chloe. Przemęczona kobieta przestała dawać sobie radę z jego obecnością. W związku z tym Einstein planuje przeprowadzkę. Zamierza przenieść się do umysłu Zaca (Stéphane Plaza). Mężczyzna ten jest pszczelarzem i kelnerem. Zmaga się również z depresją. Aby zamiana doszła do skutku, całą trójkę czekają dwie niesamowite, halucynogenne doby.",Film,Komedia,2018,,4.4,139,"France, Belgium",https://cda-hd.cc/53795/zgubilam-alberta-i-lost-albert-original-jai-perdu-albert-2018-online/,https://image.tmdb.org/t/p/w185/kfXrPxdnrR4866tbz6EJlIdJym3.jpg
Przez miłość / Out of Love (2016),"Utalentowany kucharz, Rosjanin Nikolai (Daniil Vorobyov) poznaje Varyę (Naomi Velissariou), Greczynkę o rosyjskim imieniu. Para zakochuje się w sobie od pierwszego wejrzenia. Szybko rodzi się między nimi gorące uczucie, a zakochani wydają się być sobie przeznaczeni. Z czasem jednak przekonują się, że miłość ma różne odcienie i wiele twarzy. Obraz nominowanej do Europejskiej Nagrody Filmowej Palomy Aguilery Valdebenito jest pełną emocji opowieścią o dwojgu zakochanych, pokazującą rozwój ich burzliwej relacji, blaski i cienie ich namiętnego uczucia.",Film,Dramat,2015,,6.3,220,Netherlands,https://cda-hd.cc/9053/przez-milosc-out-of-love-2016-online/,"https://m.media-amazon.com/images/M/MV5BNTBiNzk5OGItYTJmYy00NjVhLTlmNGQtNDQ3NmZhZDQwNDVlL2ltYWdlL2ltYWdlXkEyXkFqcGdeQXVyNjk4MDMwMDQ@._V1_UY268_CR4,0,182,268_AL_.jpg"
Psi Patrol: Odrzutowce na ratunek / Paw Patrol: Jet to the Rescue (2020),"W tym nowym filmie super szczeniaki muszą bronić Barkingburga przed księciem Flappington, który zdobył moc potężnego klejnotu lewitacji.",Film,"Animacja, Familijny",2020,56,6.4,46,,https://cda-hd.cc/52934/psi-patrol-odrzutowce-na-ratunek-paw-patrol-jet-to-the-rescue-2020/,https://image.tmdb.org/t/p/w185/qHcn3PbjVHxBweDZxWpYH3JfugS.jpg
Na skraju świata / Until the Edge of the World / Bis die Welt einen Rand bekommt (2019),"Pięciolatka nie może zrozumieć, co dzieje się z jej ojcem. Matka tłumaczy jej wszystko, mówiąc: „jest z nami, ale jednocześnie jest gdzieś daleko”. Dziewczynka, uciekając w świat fantazji, wyobraża sobie, że ojciec jest na Księżycu.",Film,Dramat,2019,,5.4,12,Germany,https://cda-hd.cc/52747/na-skraju-swiata-until-the-edge-of-the-world-bis-die-welt-einen-rand-bekommt-2019-online/,https://image.tmdb.org/t/p/w185/xjvVzlkOZLs0XJP3vuznDrTRsFO.jpg
Spirala / Spiral (2019),"Malik (Jeffrey Bowyer-Chapman) i Aaronie (Ari Cohen) zaczynają otrzymywać homofobiczne groźby, gdy przeprowadzają się do małego amerykańskiego miasteczka, aby wychować tam swoją nastoletnią córkę. W miarę jak niebezpieczeństwo staje się coraz bardziej prawdziwe, Malik zaczyna podejrzewać, że zagrażają im jeszcze mroczniejsze siły.",Film,"Dramat, Horror, Tajemnica, Thriller",2020,,5.6,2271,,https://cda-hd.cc/51781/spirala-spiral-2019-online/,https://image.tmdb.org/t/p/w185/mkIek8qY0tc8YxSgUs83bkWFihD.jpg
Poza prawem / Outlawed (2018),"Po tragicznym finale jednej z misji, Jake nie może dojść do siebie. Kiedy jednak była dziewczyna chce rozwiązać zagadkę śmierci ojca, były komandos postanawia jej pomóc.",Film,Akcja,2018,,4.9,1053,,https://cda-hd.cc/50876/poza-prawem-outlawed-2018-online/,https://image.tmdb.org/t/p/w185/gOgKZIk9S1MreMC7AjyFhcrK4Oz.jpg
Miłość na klik / Ishq Click (2016),"Aditya, młody fotograf zaprasza Sophie do Bombaju. Proponuje jej karierę modelki. Dziewczyna osiąga popularność i zakochuje się w artyście, ale ten łamie jej serce, żeniąc się z Irą.",Film,"Dramat, Romans",2016,,4.4,83,N/A,https://cda-hd.cc/9108/ishq-click-2016-online/,"https://m.media-amazon.com/images/M/MV5BYmEwMGMzNjctNjcwZi00ZGY4LTgwNDYtMjVkMjEzNDA5OGRkXkEyXkFqcGdeQXVyNjc5MjUyNzQ@._V1_UY268_CR1,0,182,268_AL_.jpg"
Taniec śmierci / Tantsy nasmert (2017),"Rok 2070, postapokaliptyczne ruiny Moskwy zniszczonej w czasie wojny jądrowej. Ocaleli mieszkańcy żyją w podziemnym bunkrze, który tworzy swoiste miasto. Ich najważniejszą rozrywką jest turniej tańca, w którym startuje młodzież. Nie są to jednak zwykłe zawody, ale igrzyska śmierci, gdzie przeżyć może tylko zwycięzca. Pokonani zawodnicy są przemieniani w proch, a energia ich ciał zasila pole siłowe chroniące aglomerację przed zabójczym promieniowaniem jądra Ziemi. Utarty schemat widowiska zostaje zagrożony przez chłopaka, zmuszonego przez milicje do udziału w turnieju. Kostya (Ivan Zhvakin) zakochuje się w córce dygnitarza, która nosi imię Anya (Lukerya Ilyashenko). Jest ona ochotniczką gotową oddać swoje życie dla dobra reszty mieszkańców. Śmiałek pragnie uratować dziewczynę.",Film,"Akcja, Dramat, Sci-Fi",2017,,2.7,763,Russia,https://cda-hd.cc/47688/taniec-smierci-tantsy-nasmert-2017-online/,https://image.tmdb.org/t/p/w185/cPmwc5ifaCRYnOHfev2POCBB9BD.jpg
Ostatnia arystokratka / Poslední aristokratka (2019),"Film na podstawie książki Evžen Boček „Ostatnia arystokratka” opowiadającej o rodzinie Kostków, która powraca do Czech z Ameryki. Ich cel? Przejęcie zamku Kostka, dawnej siedziby rodu. Przewrotny humor i galeria nietuzinkowych osobowości to gwarancja doskonałej zabawy.",Film,Komedia,2020,,5.8,101,Czech Republic,https://cda-hd.cc/47606/ostatnia-arystokratka-posledni-aristokratka-2019-online/,https://image.tmdb.org/t/p/w185/LoCJsebWqTWzc77U3X8y2BVGG6.jpg
The Bad Guys: The Movie / Nappeun nyeoseogdeul: Deo mubi (2019),"Po zmasakrowaniu więziennego konwoju, powstaje na polecenie komendanta policji zespół pościgowy składający się z przestępców. Wkrótce okazuje się, że stawka jest o wiele wyższa niż samo pojmanie zbiegów.",Film,"Akcja, Kryminał, Thriller",2019,,5.9,717,South Korea,https://cda-hd.cc/47477/the-bad-guys-the-movie-nappeun-nyeoseogdeul-deo-mubi-2019-online/,https://image.tmdb.org/t/p/w185/tKaXyzUDXaWRWj5XC96Ousr9lJV.jpg
Tylko nie zaśnij / Sleepless beauty / Ya ne splyu (2020),"Mila zostaje porwana. Dziewczyna jest przetrzymywana w starym garażu, a nieznany głos przekazuje jej surowe zasady: nie może spać, ale musi wykonywać dziwne zadania, które dla niej przygotowano…",Film,Horror,2020,,4.5,221,Russia,https://cda-hd.cc/46875/tylko-nie-zasnij-sleepless-beauty-ya-ne-splyu-2020-online/,https://image.tmdb.org/t/p/w185/gqhqDba3n3oou51rsY9WSuVJfTx.jpg
Zabawa w chowanego (2020),"Drugi, po głośnym „Tylko nie mów nikomu”, dokumentalny film braci Sekielskich opowiadający o pedofilii w kościele katolickim.",Film,Dokumentalny,2020,,7.2,235,Poland,https://cda-hd.cc/46146/zabawa-w-chowanego-2020-online/,https://image.tmdb.org/t/p/w185/3FRwR8IQ02YyyqQlw0Futi7pWt9.jpg
Nieśmiertelne życie Henrietty Lacks / The Immortal Life of Henrietta Lacks (2017),"Historia oparta na faktach. W 1951 roku młoda czarna kobieta zmarła na raka. Jej śmierć zmieniła historię medycyny. Niezwykła opowieść o życiu Henrietty Lacks, od której pobrano słynne komórki HeLa.",Film,Dramat,2017,,6.3,2952,USA,https://cda-hd.cc/16053/niesmiertelne-zycie-henrietty-lacks-the-immortal-life-of-henrietta-lacks-2017-online/,https://image.tmdb.org/t/p/w185/dzkd72ECEwMAwNZUypAnlQJ6o6h.jpg
Cała prawda o antybiotykach / The Truth About Antibiotics (2019),"Wielu ekspertów uważa, że wkraczamy w niebezpieczną erę postantybiotykową. Dziennikarka Angela Rippon sprawdza, co walka z bakteriami odpornymi na antybiotyki oznacza dla lekarzy oraz pacjentów.",Film,Dokumentalny,2019,,6.7,2222,UK,https://cda-hd.cc/43838/cala-prawda-o-antybiotykach-the-truth-about-antibiotics-2019-online/,https://i111.fastpic.ru/big/2020/0401/73/8269172909f60f923e0a03b15fecd673.jpg
Upiorna rodzinka / Strašidla (2016),"Młody urzędnik Jindrich Patočka (Vladimír Polívka) zostaje delegowany, by uporządkować sprawy należącego do miasta starego zamku z ogrodem. Lokatorzy tej posiadłości nie płacą czynszu i podatków, nie pracują i nie posyłają dzieci do szkoły. Okazuje się, że jest to rodzina arystokratycznych duchów, które dotąd zajmowały się jedynie straszeniem, czarami i innymi upiornymi rozrywkami. Na jej czele stoi Hugo (Bronislav Kotiš) oraz jego żona Patricie (Tereza Kostková). Urzędnik nie zniechęca się jednak tym, że duchy nie mają wiedzy na temat ludzkich trosk materialnych. Angażuje się w pomoc dla nich, a przy okazji jego serce bije mocniej na widok najstarszej córki gospodarzy, rusałki Jutrzenki (Sara Sandeva).",Film,"Fantasy, Komedia",2016,,4.1,36,Czech Republic,https://cda-hd.cc/43814/upiorna-rodzinka-strasidla-2016-online/,https://image.tmdb.org/t/p/w185/fryvMV2w5KOP8PmT41U5NVFFftQ.jpg
"Boże, błogosław Amerykę / God Bless America (2019)","W Stanach Zjednoczonych religia jest głęboko zakorzeniona w społeczeństwie, choć oficjalnie państwo jest świeckie. Większość chrześcijan to protestanci, wielu z nich głosowało na Donalda Trumpa. Każdego roku w Pensylwanii odbywa się Creation Festival – największy festiwal muzyki chrześcijańskiej w USA. Wpływy religii widoczne są nie tylko w takich sferach jak rodzina czy edukacja. W mieście Louisa w Wirginii pastor Marc O’Connor towarzyszy szeryfowi podczas patroli, by ewangelizować zatrzymanych. W muzeach na południu kraju prezentowane są dowody potwierdzające tezy wyznawców kreacjonizmu. W Georgii chrześcijańskie oddziały ochotnicze przygotowują się do walki partyzanckiej.",Film,Dokumentalny,2019,,5.5,2121,USA,https://cda-hd.cc/43746/boze-blogoslaw-ameryke-god-bless-america-2019-online/,https://raptureandendtimes.files.wordpress.com/2019/07/god-bless-usa.jpg
Hitlerjugend: nastoletni zabójcy / Hitler’s Teen Killers (2019),"Opowieść o młodych ludziach, którzy dorastali w nazistowskich Niemczech. W czerwcu 1943 roku w Antwerpii powstała 12 Dywizja Pancerna SS „Hitlerjugend”. Tysiące nastoletnich fanatyków przyrzekło oddać życie za Führera. Wysłano ich m.in. do Normandii, gdzie mieli zatrzymać inwazję aliantów. Nie zabraknie materiałów archiwalnych i relacji świadków, którzy opowiedzą o tym, jak członkowie okrytej niesławą jednostki budzili grozę, siali strach i zniszczenie.",Film,Historyczny,2019,52,6.1,2020,,https://cda-hd.cc/43574/hitlerjugend-nastoletni-zabojcy-hitlers-teen-killers-2019-online/,https://cda-hd.cc/wp-content/uploads/hitler.jpg
Heinz (2018),"Animacja dla widzów dorosłych. W przedziwnym świecie Henza zwierzęta zachowują się jak ludzie. W miszmaszu Amsterdamu szczęśliwie współistnieją czarownice, kosmici czy kolekcjonerzy znaczków…",Film,Animacja,2019,,6.1,30,Netherlands,https://cda-hd.cc/43654/heinz-2018-online/,"https://m.media-amazon.com/images/M/MV5BMjdjNGE5NjQtNTMyNC00MjM4LTllMTgtZjdmMDhmYzc0ZWRmXkEyXkFqcGdeQXVyODQxNzI4NjU@._V1_SY1000_CR0,0,666,1000_AL_.jpg"
54 godziny cz.1 / Gladbeck (2018),"Niemcy, 1988 r. Po napadzie na bank dwaj bandyci biorą jego pracowników jako zakładników i wraz z nimi uciekają z miejsca zdarzenia. Historia oparta na faktach. Obrazuje olbrzymią liczbę błędów popełnionych przez media i policję podczas próby ratowania uprowadzonych osób.",Film,"Dramat, Kryminał, Thriller",2018,,7.7,898,Germany,https://cda-hd.cc/43291/54-godziny-cz-1-gladbeck-2018-online/,https://image.tmdb.org/t/p/w185/4DtB40Rf7Qh6UvmRZjX37jgYExj.jpg
Świat bakterii / Bacterial World – Microbes That Rule Our World (2017),"Bakteria jako siła sprawcza życia na naszej planecie. Dokument prezentuje najnowsze badania nad naturą mikrobów i ich roli w łańcuchu ewolucyjnym. Okazuje się, że w tej dziedzinie wciąż zostało wiele do odkrycia.",Film,Dokumentalny,2016,,6.5,13,France,https://cda-hd.cc/43216/swiat-bakterii-bacterial-world-microbes-that-rule-our-world-2017-online/,https://image.tmdb.org/t/p/w185/7Nvt5Up8LpKnegkRnCDIsvBPNBo.jpg
Pandemia zabójczej grypy / The Flu That Killed 50 Million (2018),"Christopher Eccleston opowiada o pandemii z 1918 roku. Grypa uśmierciła wówczas ponad 50 milionów ludzi. Po zawarciu rozejmu w Compiegne silnie zakaźna choroba przemieszcza się wraz z powracającymi do domów żołnierzami. Grypa zabije niemal jedną trzecią ówczesnej ludności świata, pochłaniając więcej ofiar niż dwie wojny światowe. Dokument przedstawia przerażającą historię – od żołnierza, który przeniósł wirus na front zachodni, do lekarza, który podjął walkę z September 2018rozprzestrzeniającym się patogenem.",Film,"Dokumentalny, Historyczny",2018,,7.0,25,UK,https://cda-hd.cc/43209/pandemia-zabojczej-grypy-the-flu-that-killed-50-million-2018/,https://image.tmdb.org/t/p/w185/wDbMEMTHot7lrLkNuNqQGBT6zqh.jpg
Miss Hanoi (2018),,Film,Kryminał,2018,,5.7,140,Czech Republic,https://cda-hd.cc/35696/miss-hanoi-2018-online/,https://image.tmdb.org/t/p/w185/lupfydi5gMQ14ThcPg3GwcdtfM3.jpg
Death Race 2050 (2017),"W 2050, gdy ludzie kontrolowani są przez korporacje, które fundują im pranie mózgu dzięki niezliczonym reality show, organizowany jest Wyścig Śmierci. Walczący o utrzymanie tytułu cyborg Frankenstein sabotowany jest przez swego pilota.",Film,"Akcja, Komedia, Sci-Fi",2017,,3.7,4229,USA,https://cda-hd.cc/11148/death-race-2050-2017-online/,https://image.tmdb.org/t/p/w185/5mI8yqZZBlZpvd0aT5YXbR8oEvT.jpg
Pokój ze stajnią: Góry przenosić / Zimmer mit Stall: Berge versetzen (2019),"W obliczu problemów z górskim pensjonatem Sophie (Aglaia Szyszkowitz) i Barthl (Friedrich von Thun) muszą się dogadać. Przypadkowo odkrywają, że brat mężczyzny planuje stworzyć opodal Fuchsbichlerhof innowacyjny ośrodek campingowy.",Film,"Dramat, Komedia",2019,87,5.3,,Germany,https://cda-hd.cc/42669/pokoj-ze-stajnia-gory-przenosic-zimmer-mit-stall-berge-versetzen-2019/,"https://m.media-amazon.com/images/M/MV5BMzNkMmYxNjYtMjdlYi00YzYxLWI3MDEtNDI0ZGQ4ZjMxNDQyXkEyXkFqcGdeQXVyNzgwMTU0MDE@._V1_SY1000_CR0,0,733,1000_AL_.jpg"
Śmiertelne wybawienie / Stalker’s Prey (2017),"Laura Wilcox (Saxon Sharbino) obchodzi swoje osiemnaste urodziny. Wybiera się ze Nickiem Jordanem (Luke Slattery), swoim partnerem, na rejs łódką po morzu. Dochodzi do tragedii i chłopak zostaje zabity przez rekina. Dziewczyna uchodzi z życiem dzięki Bruce’owi Kane (Mason Dye). Przystojny mężczyzna dopiero co przyjechał do domu z college’u. Wkrótce Laura zdaje sobie sprawę, że wybawiciel nie zamierza po prostu dać jej spokoju. Staje się coraz bardziej natrętny.",Film,Thriller,2017,,5.2,374,USA,https://cda-hd.cc/42663/smiertelne-wybawienie-stalkers-prey-2017-online/,https://image.tmdb.org/t/p/w185/eQlz1E45qt9vW2wbDFrfXXSDwgb.jpg
Moja mała / My Little One (2019),"Jade (Anna Mouglalis) to mieszkanka smaganych wiatrem pustynnych terenów Arizony. Pewnego dnia kontaktuje się z byłymi kochankami, Europejczykami Aleksem (Vincent Bonillo) i Bernardo (Mathieu Demy), i namawia ich do wizyty. Mężczyźni na to wezwanie wyruszają do Navajo Nation, gdzie odkrywają nietypowy styl życia Jade i poznają jej frywolną, dziesięcioletnią córkę Fridę (Ruby Matenko). To spontaniczne spotkanie zaowocuje radykalnymi zmianami w ich poglądach na życie, miłość i śmierć. Interesująca produkcja, która zmusza do refleksji.",Film,Dramat,2019,,6.9,13,Switzerland,https://cda-hd.cc/42473/moja-mala-my-little-one-2019-online/,https://image.tmdb.org/t/p/w185/3MVICn1AbUcaSq7teztu0jWwDLP.jpg
Ivan (2017),"Mara (Marusa Majer) ma romans z żonatym biznesmenem Rokiem (Matjaz Tribuson), którego kocha nad życie. Owocem ich związku jest mały Ivan. Pewnego dnia młoda matka odkrywa, że jej ukochany zniknął. Mężczyzna oskarżony jest o popełnienie przestępstwa. Co gorsza, Mara zostaje brutalnie pobita przez kumpli jego żony. W końcu parze udaje się odnaleźć i być razem. Młoda matka musi jednak dokonać niełatwego wyboru między kochankiem a dzieckiem…",Film,Dramat,2019,,7.3,191,"Slovenia, Croatia",https://cda-hd.cc/41947/ivan-2017-online/,https://image.tmdb.org/t/p/w185/l3Drwmr8SwOh6QUw8o557EEbd8.jpg
Puppy Star: Boże Narodzenie / Puppy Star Christmas (2018),"Nowa paczka Pup Star natrafia na rywalizujący zespół, który chce zrujnować Boże Narodzenie, mobilizują siły, by ratować świątecznego ducha.",Film,Familijny,2018,,3.5,126,USA,https://cda-hd.cc/41930/puppy-star-boze-narodzenie-puppy-star-christmas-2018-online/,https://image.tmdb.org/t/p/w185/ztmVR4XlmAWtHFjDBWh2VyYcyuC.jpg
Korpoludki / Corporate Animals (2019),"Co za wspaniała firma! Produkuje jadalne sztućce, dba o środowisko naturalne, a przede wszystkim troszczy się o swoich ludzi. Pod opieką niestabilnej emocjonalnie szefowej (Demi Moore), lubiącej wygłaszać kontrowersyjne teorie w stylu: „Mózg to największy mięsień”, kilkoro pracowników bierze udział w wyjeździe integracyjnym w Nowym Meksyku. Wycieczka szybko zamienia się w koszmar, gdy na skutek trzęsienia ziemi grupa zostaje uwięziona w jaskini. Dramatyczna sytuacja powinna zmusić ich do współpracy, lecz zamiast tego zaczyna się rozliczanie winnych, a na jaw wychodzą najgorsze firmowe sekrety. Po kilku dniach spędzonych w pułapce padnie wreszcie kluczowe pytanie: kogo zjeść, żeby przetrwać?",Film,"Horror, Komedia",2019,,4.4,1095,USA,https://cda-hd.cc/41923/korpoludki-corporate-animals-2019-online/,https://image.tmdb.org/t/p/w185/nFiJwUXiKLcsblGKvUPHyGjLEn7.jpg
Nadmiar łaski / Troppa grazia (2018),"Lucia (Alba Rohrwacher) i Arturo (Elio Germano) przechodzą poważny kryzys małżeński. Jedno z nich dopuściło się zdrady. Para żarliwie się kłóci. Nie mogą jednak robić tego zbyt głośno z uwagi na swoją nastoletnią córkę, Rosę (Rosa Vannucci), która rzekomo śpi. Po awanturze mężczyzna wychodzi z domu. Tymczasem Lucia musi przystosować się do nowej rzeczywistości. Niedługo po kłótni małżonków, kobieta spotyka na swojej drodze Matkę Boską.",Film,"Dramat, Komedia",2018,,6.0,949,Italy,https://cda-hd.cc/41832/nadmiar-laski-troppa-grazia-2018-online/,https://image.tmdb.org/t/p/w185/hdN93wHBtmqPh3tlxS4bpHkSAOA.jpg
Świąteczny rycerz / The Knight Before Christmas (2019),"Rycerz w magiczny sposób przenosi się z XIV wieku do współczesnego Ohio i zakochuje w nauczycielce, która przestała wierzyć w miłość.",Film,"Dramat, Fantasy, Komedia, Przygodowy, Romans",2019,,5.5,2211,USA,https://cda-hd.cc/41227/swiateczny-rycerz-the-knight-before-christmas-2019-online/,https://image.tmdb.org/t/p/w185/ivymBQYzYqZoLhvgYg77gSzXKsA.jpg
