title,description,show_type,tags,year,length,rating,votes,countries,link,image_link
Klaus (2019),"Jesper (Jason Schwartzman) okazuje się najgorszym studentem w historii akademii listonoszy i zostaje przeniesiony na mroźną wyspę za północnym kołem podbiegunowym, gdzie skłóceni mieszkańcy rzadko ze sobą rozmawiają, a o pisaniu listów nie ma nawet mowy. Jesper jest już bliski rezygnacji, gdy znajduje wsparcie u miejscowej nauczycielki o imieniu Alva (Rashida Jones) i poznaje Klausa (nagrodzony Oscarem J.K. Simmons), tajemniczego stolarza, który mieszka samotnie w chatce pełnej własnej roboty zabawek. Ta wyjątkowa przyjaźń przywraca radość życia w Smeerensburg, skłaniając sąsiadów do hojności i wprowadzając nowe, pełne magii zwyczaje, jak wieszanie skarpet na kominku.",Film,"Animacja, Familijny, Komedia, Przygodowy",2019,,8.2,160219,Spain,https://cda-hd.cc/41131/klaus-2019-online/,https://image.tmdb.org/t/p/w185/q125RHUDgR4gjwh1QkfYuJLYkL.jpg
Parking (2019),"Adrian (Mihai Smarandache) jest ubogim rumuńskim pisarzem, który mieszka w przyczepie na obrzeżach zatłuczonej andaluzyjskiego miasta. Hiszpanie nie ufają mu, on jednak stara się zwalczyć panujące tam stereotypy, pracując za niewielkie pieniądze. Pewnego dnia podczas pobytu w innym mieście spotyka muzyczkę Marię (Belén Cuesta). Jako niepoprawny romantyk próbuje zdobyć jej serce. Obraz doceniony na MFF w Transylwanii.",Film,"Dramat, Romans",2018,,6.7,106,"Romania, Spain, Czech Republic",https://cda-hd.cc/40817/parking-2019-online/,https://image.tmdb.org/t/p/w185/3a7WzCr5UXD6Caum8SFCrXmvTOs.jpg
Draug (2018),"W XI wieku misjonarz zaginął gdzieś w ogromnych lasach graniczących z północnymi częściami Szwecji. Wysłano po niego ratowników, ale głęboko w tych lasach znajdą coś zupełnie innego. Coś ciemnego. Coś starożytnego. Coś złego.",Film,Horror,2019,,6.2,47,Sweden,https://cda-hd.cc/40590/draug-2018-online/,https://image.tmdb.org/t/p/w185/8PtIw0roIIRJGh8Al7Zh1o5JHOw.jpg
Szubienica 2 / The Gallows Act II (2019),"Kiedy Ana Rue przenosi się do nowej, prestiżowej szkoły aktorskiej, napotyka złowrogiego ducha po wzięciu udziału w wyzwaniu.",Film,"Horror, Tajemnica, Thriller",2019,,7.1,19,USA,https://cda-hd.cc/40437/the-gallows-act-ii-2019/,https://image.tmdb.org/t/p/w185/h2OCcYwUGqSBvqHjE3QBtTNeKXY.jpg
Doom: Annihilation (2019),"Film opowiada o grupie kosmicznych marines, którzy odpowiadają na wezwanie ratunkowe z bazy na księżycu Marsa, tylko po to, by odkryć, że miejsce zostało przejęte przez demoniczne stwory, które chcą stworzyć Piekło na Ziemi.",Film,"Akcja, Horror, Przygodowy, Sci-Fi, Thriller",2019,,3.6,1508,USA,https://cda-hd.cc/40352/doom-annihilation-2019-online/,https://image.tmdb.org/t/p/w185/y0veZvK4Q0NzoAjbFlUrGr1cvZ8.jpg
Wendeta / Brimstone (2016),,Film,"Thriller, Western",2017,148,7.5,2541,"Netherlands, France, Germany, Belgium, Sweden, UK",https://cda-hd.cc/14188/brimstone-2016-online/,https://image.tmdb.org/t/p/w185/fYYruOEwdbJhlgdfK1HxPhXwHiB.jpg
"Całujesz i masz / Pup-o, ma! (2018)","Trzech spragnionych miłości samotnych pasterzy próbuje pocałować upatrzone panie, licząc na to, że uda im się skłonić je do małżeństwa.",Film,Komedia,2019,,6.5,316,Romania,https://cda-hd.cc/40138/calujesz-i-masz-pup-o-ma-2018-online/,https://image.tmdb.org/t/p/w185/vVrKGKTjk9ULFSfWJvYDhbPcnob.jpg
Hoax (2019),"Zespół śledczy podróżuje w głąb odległej pustyni Colorado po tym, jak grupa młodych obozowiczów zostaje brutalnie zamordowana przez coś, co może być Wielką Stopą.",Film,Horror,2019,,3.6,314,USA,https://cda-hd.cc/39978/hoax-2019-online/,https://image.tmdb.org/t/p/w185/hK7s0dsNLGyEFokHyvyyTj1KCYL.jpg
Palące pożądanie / Manmarziyaan (2018),"Trójkąt miłosny między uduchowioną dziewczyną, towarzyskim chłopakiem i narzeczonym, który nadaje się na męża.",Film,Romans,2018,,6.9,5482,India,https://cda-hd.cc/39905/palace-pozadanie-manmarziyaan-2018-online/,https://image.tmdb.org/t/p/w185/spTuL3PJFYQsxBdAHbUJlHtwwyi.jpg
Wigilijny koszmar / Christmas Apparition (2016),"Emma opiekuje się dwójką nastolatków w przestronnym domu. Pomimo starań, by dało się odczuć magię i ciepło Bożego Narodzenia, para młodych domowników traktuje kobietę z wrogością i podejrzliwością. Wraz z upływem czasu, pobyt Emmy w nowym domu staje się coraz mniej przyjemny. Natężają się jej stany lękowe, w mieszkaniu objawiają się przedziwne cienie, a codzienne życie wydaje się balansować na granicy rzeczywistości i snu. Emmę, zmęczoną napiętą atmosferą i niepokojącymi obrazami z własnego umysłu, zaczynają nawiedzać wizje nieznajomego w domu. Niekończące się koszmary i wychodzące na jaw straszliwe fakty o nowo poznanej rodzinie zmuszają Emmę do konfrontacji z niewyobrażalnym złem, o którym jej wybujałemu umysłowi nawet się nie śniło.",Film,Thriller,2016,,5.2,422,USA,https://cda-hd.cc/23122/wigilijny-koszmar-christmas-apparition-2016/,"https://images-na.ssl-images-amazon.com/images/M/MV5BZmRlNjI3NzMtNmViZS00OTJkLWIyZTUtOTUzNGRkNzU1M2Q3XkEyXkFqcGdeQXVyMzIwNjMzOTM@._V1_UX182_CR0,0,182,268_AL_.jpg"
Zemsta córki kaznodziei / I Killed My BFF: The Preacher’s Daughter / Do Unto Others (2018),"Lily, córka kaznodziei, zaprzyjaźnia się z charyzmatyczną Rae i pod jej wpływem stopniowo porzuca bogobojne życie. Nagła śmierć Jasona, brata Lily, sprawia, że obwinia ona Rae, podejrzewając ją o konszachty z siłami zła. Postanawia wymierzyć jej karę.",Film,"Dramat, Thriller",2018,,5.0,101,USA,https://cda-hd.cc/39755/zemsta-corki-kaznodziei-i-killed-my-bff-the-preachers-daughter-do-unto-others-2018-online/,https://image.tmdb.org/t/p/w185/3BcBu4C6fWuUd8Keyqzb92wjpn.jpg
Arktyczna apokalipsa / Arctic Apocalypse (2019),"Katastroficzny obraz opowiadający historię rodziny przemierzającej mroźne bezdroża, po tym jak zmiany klimatyczne skuwają północną półkulę lodem.",Film,Akcja,2019,,3.7,6,USA,https://cda-hd.cc/39701/arktyczna-apokalipsa-arctic-apocalypse-2019-online/,https://image.tmdb.org/t/p/w185/6yOakcmbhgV0PXaUvL6iCzxeeb3.jpg
Boi (2019),Młody szofer na życiowych rozdrożach obwozi dwóch klientów po Barcelonie i daje się wciągnąć w realizację ich tajemniczego zadania.,Film,"Tajemnica, Thriller",2019,,4.7,115,Spain,https://cda-hd.cc/39583/boi-2019-online/,https://image.tmdb.org/t/p/w185/2lGKEaL315JTlusiQDRobBA84ES.jpg
Apollo 11: zaginione nagrania / Apollo: The Forgotten Films (2019),"W 1969 roku miliony ludzi patrzyły, jak Neil Armstrong stawia pierwsze kroki na Księżycu. Jednak za tymi słynnymi zdjęciami kryje się wiele niedopowiedzeń. Niektóre teorie pełne są wątpliwości, co do autentyczności materiałów. Ujawnione zostają nieodkryte dotąd archiwa.",Film,"Biograficzny, Dokumentalny, Historyczny",2019,,8.6,10,USA,https://cda-hd.cc/39486/apollo-11-zaginione-nagrania-apollo-the-forgotten-films-2019-online/,https://image.tmdb.org/t/p/w185/ea1F7HmYXyTxsZqnHnZ0v8dJ5p5.jpg
Lądowanie na Księżycu: Taśmy prawdy / Moon Landing The Lost Tapes (2019),"20 lipca 1969 roku doszło do jednego z najważniejszych wydarzeń w dziejach ludzkości – Neil Armstrong stanął na powierzchni Księżyca. Sukces ten okupiony był ciężką pracą. Poprzedziło go wiele nieudanych przedsięwzięć. Zaprezentowane zostaną niepokazywane wcześniej materiały, w tym wywiady z astronautami i inżynierami czy nagrania ze Srebrnego Globu, które dotąd uważano za zaginione. Przejmujący obraz uzupełnią ponadto prywatne nagrania. Twórcy dołożyli starań, aby widz miał wrażenie osobistego uczestniczenia w wydarzeniach.",Film,Dokumentalny,2019,,6.0,323,USA,https://cda-hd.cc/39427/ladowanie-na-ksiezycu-tasmy-prawdy-moon-landing-the-lost-tapes-2019/,https://m.media-amazon.com/images/M/MV5BY2ExOThiZDgtMzlkMi00OGFhLTllNGEtMGRlNDlhNTBjMWM5XkEyXkFqcGdeQXVyMzM3Mjk4NQ@@._V1_FMjpg_UX1000_.jpg
Źyciowy gracz / Spielmacher (2018),"Ivo (Frederick Lau) grał niegdyś w zawodowej drużynie piłki nożnej. Na kartach jego przeszłości zapisało się także parę kryminalnych incydentów. Teraz Ivo chce zmienić swoje życie. Skłonności do łamania prawa jednak okazują się jednak zbyt silne, by pozwolić o sobie zapomnieć. Pewnego dnia bowiem oszust Dejansa (Oliver Masucci) zauważa u Ivo naturalny talent do zakładów w dziedzinie sportu i postanawia zaangażować go w kolejne matactwa. Były piłkarz poznaje też młodego sportowca Lucasa (Mateo Wansing Lorrio) i zakochuje się w jego matce.",Film,"Dramat, Kryminał, Sportowy",2018,,6.4,102,Germany,https://cda-hd.cc/39344/zyciowy-gracz-spielmacher-2018-online/,https://image.tmdb.org/t/p/w185/k0ij0ahAG1uJl6C40ZqzjKqAe3z.jpg
Rusałka. Jezioro umarłych / Rusalka: Ozero myortvykh (2018),"Marina ma wyjść za Romana. Tymczasem jej ukochany spotyka tajemniczą dziewczynę i coraz bardziej ulega czarowi, który na niego rzuciła. Marina musi przezwyciężyć lęk przed wodą, by pokonać demony.",Film,"Dramat, Fantasy, Horror, Romans, Tajemnica, Thriller",2018,,4.3,680,Russia,https://cda-hd.cc/39104/rusalka-jezioro-umarlych-rusalka-ozero-myortvykh-2018-online/,https://image.tmdb.org/t/p/w185/9s1dZT7G95zL3JZ3K34VHZi6oa5.jpg
Mój tata pisał pornografię / My Dad Wrote a Porno (2019),"Podcast z seksualnym podtekstem, który stał się wielkim hitem po obu stronach Atlantyku. Produkcja trafiła do telewizji jako wydarzenie specjalne nagrane przed publicznością na żywo w Roundhouse.",Film,Komedia,2019,,6.2,166,UK,https://cda-hd.cc/38887/moj-tata-pisal-pornografie-my-dad-wrote-a-porno-2019-online/,https://image.tmdb.org/t/p/w185/za8xRL3ygFyk1zRzAEsYuu26Zht.jpg
Gra o Tron: Ostatnia warta / Game of Thrones: The Last Watch (2019),"Film dokumentalny „Gra o Tron: Ostatnia warta” („Game of Thrones: The Last Watch”) zanurza się głęboko w pełen błota i krwi serialowy świat „Gry o tron”, aby pokazać pot i łzy, jak również chwile triumfu, które towarzyszyły jego twórcom przy kreowaniu świata Westeros i jego bohaterów. Zdjęcia kręcone były nie tylko w studiach, ale również na polach i parkingach w Irlandii Północnej. Dokument ten jest bezprecedensową, osobistą kroniką odsłaniającą kulisy powstawania „Gry o Tron”. Twórcy podążają w nim za członkami ekipy i obsadą serialu, którym przyszło zmagać z ekstremalną pogodą, goniącymi ich terminami czy nieustanną ciekawością podekscytowanych fanów, którzy marzyli o poznaniu chociaż rąbka fabuły. Produkcja ta jest nie tylko kroniką pracy na planie, to także zabawna i przejmująca historia, opowiedziana ze swadą i dużą dozą intymności, przedstawiająca słodko-gorzką prawdę o radości, jaką daje tworzenie świata i smutku towarzyszącym konieczności pożegnania się z nim.",Film,Dokumentalny,2019,,7.6,2378,USA,https://cda-hd.cc/38875/gra-o-tron-ostatnia-warta-game-of-thrones-the-last-watch-2019-online/,https://image.tmdb.org/t/p/w185/9qpuNPi06IdqqZdRunRRSOl65RS.jpg
Perfekcja / The Perfection (2018),"W tym thrillerze o zawiłej fabule wirtuozka wiolonczeli po długiej przerwie w karierze odszukuje dawnych mentorów i odkrywa, że mają nową utalentowaną uczennicę.",Film,"Dramat, Horror, Thriller",2019,,6.3,157,USA,https://cda-hd.cc/38829/perfekcja-the-perfection-2018/,https://image.tmdb.org/t/p/w185/tPDe68PDsgIGMs6wdJLtcwVVxA7.jpg
Uśmiechy smutnych mężczyzn / Úsmevy smutných muzu (2018),"Opowieść o czterech mężczyznach, którzy znaleźli się na dnie przez swój nałóg. Niegdyś odnoszący sukcesy, teraz pozostający na marginesie społeczeństwa alkoholicy Josef (David Svehlík), Tomáš (Ivan Franek), Milan (Jaroslav Dusek) i Honza (Ondrej Malý) doskonale zdają sobie sprawę, w jak trudnym położeniu się znaleźli. Nie odmawiają sobie jednak przyjemności odnajdywania powodów do śmiechu w najbardziej prozaicznych rzeczach.",Film,"Dramat, Komedia",2018,,6.7,143,Czech Republic,https://cda-hd.cc/38620/usmiechy-smutnych-mezczyzn-usmevy-smutnych-muzu-2018-online/,https://image.tmdb.org/t/p/w185/pHVZmtcdO39D5QE2scL4eEzIFnN.jpg
Wszystkie kolory trawy / Grass is Greener (2019),Zioło zagościło na dobre w świecie jazzu i hip-hopu. To przez nie toczą się wojny narkotykowe. Jakie piętno na amerykańskim społeczeństwie odcisnęła marihuana?,Film,Dokumentalny,2019,97,7.1,241,,https://cda-hd.cc/38470/wszystkie-kolory-trawy-grass-is-greener-2019-online/,https://image.tmdb.org/t/p/w185/xIO2FJBHYihZVnAk2uitfo7PSlI.jpg
Rozmowy z Masarykiem / Hovory s TGM (2018),"26 września 1928 roku pisarz Karel Čapek i prezydent Tomáš Garrigue Masaryk, dwie bardzo ważne postacie I Republiki Czechosłowackiej, spotykają się w ogrodach zamku Topolčianky, aby porozmawiać o przyszłości ich wspólnego dzieła literackiego. Čapek oraz Masaryk konfrontują swoje poglądy i wzajemnie się obrażają. Zadają sobie też osobiste pytania i dywagują na temat społecznej funkcji twórczości i polityki.",Film,"Biograficzny, Dramat, Historyczny",2018,,6.7,35,Czech Republic,https://cda-hd.cc/38403/rozmowy-z-masarykiem-hovory-s-tgm-2018-online/,https://image.tmdb.org/t/p/w185/crbwNXIRBbsutdTTsKsEn5HupVk.jpg
Seven in Heaven (2018),"Dwójka nastolatków wchodzi do tajemniczej szafy i pojawia się w przerażającej alternatywnej rzeczywistości. Muszą znaleźć drogę powrotną, zanim drzwi zostaną zamknięte na zawsze.",Film,"Horror, Sci-Fi",2018,,5.3,11713,USA,https://cda-hd.cc/38139/seven-in-heaven-2018-online/,https://image.tmdb.org/t/p/w185/elReufFR4NYFiBVRsD0wB2F6FDf.jpg
Sekretny świat kotów / Cats and Peachtopia (2018),"Życie młodego kota Cape’a to istna sielanka. Mieszka z tatą u dobrych ludzi, gdzie niczego im nie brakuje. Państwo są przekonani, że lepiej ułożonych i grzeczniejszych kotów ze świecą szukać. Ale wkrótce odkryją, że nie do końca mieli rację! Cape to niespokojny duch, który od dziecka marzy o wielkiej przygodzie. Gdy usłyszy opowieść o mitycznej kociej krainie, postanowi wbrew rodzicielskim zakazom wyruszyć w drogę.",Film,"Akcja, Komedia, Przygodowy",2019,,5.4,186,China,https://cda-hd.cc/39232/sekretny-swiat-kotow-cats-and-peachtopia-2018-online/,https://image.tmdb.org/t/p/w185/4WmPz5NPuJKuFkKAYSGzziOVo3Z.jpg
Madame J / Lady J (2019),"Gdy jej romans z rozpustnym markizem przybiera niekorzystny obrót, bogata wdowa korzysta z pomocy młodszej kobiety, by opracować plan zemsty.",Film,"Dramat, Romans",2019,,7.2,79,,https://cda-hd.cc/37518/madame-j-lady-j-2019-online/,https://image.tmdb.org/t/p/w185/7lRyjgYcrl0CfUBqQTJAAsFgVy.jpg
Naczelny dowódca / General Commander (2018),Funkcjonariusz GRS Jake Alexander i jego zespół młodych rekrutów ścigają najbardziej niebezpiecznych i znanych przestępców przy pomocy miliardera z Hong Kongu.,Film,Akcja,2018,,6.6,35,"UK, Philippines, Hungary",https://cda-hd.cc/37363/naczelny-dowodca-general-commander-2018-online/,"https://m.media-amazon.com/images/M/MV5BZTNmMGM4N2UtNzdkZC00MDdlLTg2ZWQtMjdiYjAxZjk2OTJhXkEyXkFqcGdeQXVyNjc0ODMzOTI@._V1_UX182_CR0,0,182,268_AL_.jpg"
Tristan i Izolda / Tristan + Isolde (2006),"Tristan, walcząc w turnieju jako reprezentant swojego władcy, zdobywa rękę pięknej Izoldy. Okazuje się, że jest ona kobietą, która niedawno ocaliła mu życie i z wzajemnością go pokochała.",Film,"Akcja, Dramat, Romans, Wojenny",2006,,6.8,48459,"USA, UK, Germany, Czech Republic",https://cda-hd.cc/37161/tristan-i-izolda-tristan-isolde-2006-online/,https://image.tmdb.org/t/p/w185/pX0JBGiSeClgcMUkiSQzkpGpi6e.jpg
30 nocy seksu / 30 Nights (2018),"W ostatniej próbie ratowania małżeństwa, Nick oraz Willa odwiedzają słynnego, aczkolwiek ekscentrycznego terapeutę związkowego. Wspólnie wyruszają w miesięczną podróż prowokacyjnych i zabawnych zadań seksualnych.",Film,Komedia,2018,,4.2,211,USA,https://cda-hd.cc/37579/30-nocy-seksu-30-nights-2018/,"https://m.media-amazon.com/images/M/MV5BMmQ4M2U2ZTktOTEyYy00YTgyLWEzNDAtNjMyY2RkODJhNzQ5XkEyXkFqcGdeQXVyNTA2ODk3OTk@._V1_UX182_CR0,0,182,268_AL_.jpg"
Big Ben – ratowanie najsłynniejszego zegara świata / Big Ben: Saving the World’s Most Famous Clock (2017),"Najsłynniejsza i największa wieża zegarowa na świecie, będąca wizytówką Londynu, przeszła remont generalny, podczas którego jej dzwony zostały wyciszone na cztery lata. O tym ogromnym przedsięwzięciu opowiada dyrektor Landmark Trust, Anna Keay, a także odpowiedzialny za niego architekt i trzej zegarmistrzowie, którzy ustawiają gigantyczny mechanizm po raz pierwszy od prawie 160 lat. Autorzy filmu przybliżają także bogatą historię Elizabeth Tower.",Film,Dokumentalny,2017,,8.7,6,UK,https://cda-hd.cc/36837/big-ben-ratowanie-najslynniejszego-zegara-swiata-big-ben-saving-the-worlds-most-famous-clock-2017-online/,"https://m.media-amazon.com/images/M/MV5BNjIyYTYyNjQtMjcwMy00YTJkLWExODctODdhN2MwZWI3MDZlXkEyXkFqcGdeQXVyODk1MDkzODU@._V1_UY268_CR151,0,182,268_AL_.jpg"
W pętli / Hurok (2016),"W wyniku wypadku samochodowego ginie spodziewająca się dziecka dziewczyna Adama. Wkrótce mężczyzna otrzymuje od losu szereg szans na naprawienie przeszłych błędów, które niefortunnie przyczyniły się do tragedii. Aby utrzymać ukochaną kobietę przy życiu, Adam musi stawić czoła konsekwencjom wcześniejszych wyborów.",Film,Thriller,2016,,7.2,247,Hungary,https://cda-hd.cc/36383/w-petli-hurok-2016-online/,https://image.tmdb.org/t/p/w185/hj4yGLUQLBUni8xbK69qV33B2UO.jpg
The Last Boy (2019),"Świat zbliża się do zagłady, umierająca matka wysyła młodego syna w poszukiwaniu miejsca, które spełnia życzenia.",Film,"Dramat, Sci-Fi",2019,,5.0,160,UK,https://cda-hd.cc/36348/the-last-boy-2019-online/,https://image.tmdb.org/t/p/w185/7o5WVpjAffERCTkrAmpqNlieAMz.jpg
Buntownicy z Seminarium / One Step Behind the Seraphim (2017),"Grupa studentów pierwszego roku seminarium po tym, jak zderzy się ze światem obłudy, fałszu i korupcji, będzie musiała zrewidować swoje oczekiwania. Czy Gabrielowi i jego kolegom uda się zachować młodzieńcze ideały? Czy złamie zasady, obowiązujące w szkole – a może będzie zmuszony poddać się surowym regułom? Doskonała opowieść o buncie, władzy i dorastaniu w niesprzyjających warunkach.",Film,Dramat,2017,,8.4,1,Romania,https://cda-hd.cc/36238/buntownicy-z-seminarium-one-step-behind-the-seraphim-2017-online/,https://image.tmdb.org/t/p/w185/kVoE5Rm8BsCBpyxo473JGSPgfRw.jpg
Johnny Gruesome (2018),"Zamordowany uczeń liceum, powraca do życia by zemścić się na swoich oprawcach",Film,"Horror, Komedia",2018,,5.0,96,USA,https://cda-hd.cc/36214/johnny-gruesome-2018-online/,https://image.tmdb.org/t/p/w185/m2l0yqOcTlAcy1mbWEayK3P6XUn.jpg
Odnajdę cię (2018),"Córka policjantki Justy – Lena zostaje uprowadzona. Kobieta, aby ją uratować decyduje się popełnić przestępstwo.",Film,Kryminał,2018,,5.0,1212,Poland,https://cda-hd.cc/35784/odnajde-cie-2018-online/,https://image.tmdb.org/t/p/w185/5aYD455MNVI61ZejyeqwntK6YPm.jpg
Mowgli: Legenda dżungli / Mowgli: Legend Of The Jungle (2018),Chłopiec wychowany w dżungli przez zwierzęta zmaga się z potężnym wrogiem — i własną naturą.,Film,"Dramat, Przygodowy",2018,,7.3,359,UK | USA,https://cda-hd.cc/35195/mowgli-legenda-dzungli-mowgli-legend-of-the-jungle-2018-online/,https://image.tmdb.org/t/p/w185/wdj8FK2bCA7iNtZRSzJHrltAwnr.jpg
Więzień labiryntu: Lek na śmierć / Maze Runner: The Death Cure (2018),"Thomas staje na czele grupy zbiegłych Streferów, którzy wyruszają z ostateczną misją. Jeśli chcą ocalić swych przyjaciół, muszą wkraść się do legendarnego Ostatniego Miasta – kontrolowanego przez DRESZCZ labiryntu, który kryje w sobie najniebezpieczniejszą z dotychczasowych pułapek. Ci, którzy wyjdą z niej żywi, poznają odpowiedzi na pytania, które Streferzy zadają sobie od chwili, gdy znaleźli się w pierwszym labiryncie.",Film,"Akcja, Sci-Fi, Thriller",2018,,6.4,91,142 min,https://cda-hd.cc/29586/wiezien-labiryntu-lek-na-smierc-maze-runner-the-death-cure-2018-online/,https://image.tmdb.org/t/p/w185/jupR6zmIfBp1yjbDw3KiU9GGhmA.jpg
A Month of Sundays (2015),"Frank jest agentem nieruchomości, którego życie pozbawione jest jakiegokolwiek uczucia. Jego matka zmarła, właśnie rozwiódł się z żoną, ma fatalny kontakt z synem. Pustkę emocjonalną niespodziewanie wypełnia tajemnicza rozmowa telefoniczna ze zmarłą matką.",Film,"Dramat, Komedia",2016,,6.4,128,Australia,https://cda-hd.cc/6266/a-month-of-sundays-2015-online/,https://image.tmdb.org/t/p/w185/smsxbWirgC3556f7uknTy2xksMK.jpg
Osaczona / Shut In (2016),"Dziecięca psycholożka musi uratować małego chłopca, który zaginął w tajemniczych okolicznościach podczas burzy śnieżnej.",Film,"Dramat, Thriller",2016,,4.8,91,"France, Canada, USA",https://cda-hd.cc/33905/osaczona-shut-in-2016-online/,https://image.tmdb.org/t/p/w185/qXIGq6ddQhIYe4Z7A86nZ1qjUME.jpg
My Little Pony Equestria Girls: Rollercoaster Przyjaźni / My Little Pony Equestria Girls: Rollercoaster of Friendship (2018),Nowa praca Rarity jako projektantki mody na paradzie w parku rozrywki wchodzi w drogę jej przyjaźni z Applejack. Dziewczyny muszą się pogodzić i rozwiązać sprawę zaginionych przyjaciółek.,Film,"Animacja, Familijny, Komedia, Muzyczny",2018,,6.4,43,"USA, Canada",https://cda-hd.cc/33770/my-little-pony-equestria-girls-rollercoaster-przyjazni-my-little-pony-equestria-girls-rollercoaster-of-friendship-2018-online/,https://image.tmdb.org/t/p/w185/cza853vKq9ilt2yw77ExfdfJDMj.jpg
Public Disturbance (2018),"Grupa The Janoskians została zaproszona na występ podczas pełnej gwiazd imprezy urodzinowej Alison, córki słynnego potentata medialnego (Mike Tyson). Występ w ostatniej chwili odwołano, więc ekipa jajcarzy postanowiła przejąć nudną imprezę i pokazać, co znaczy zakłócanie porządku.",Film,Komedia,2018,84,4.0,,USA,https://cda-hd.cc/33390/public-disturbance-2018-online/,https://image.tmdb.org/t/p/w185/1hVjwCDRa01fSh27nmXXrc1VGMa.jpg
Wilcza skóra / The Skin of the Wolf / Bajo la piel de lobo (2017),,Film,Dramat,2018,110,5.7,255,Spain,https://cda-hd.cc/32707/wilcza-skora-the-skin-of-the-wolf-bajo-la-piel-de-lobo-2017-online/,https://image.tmdb.org/t/p/w185/xh4iBc45ZzP8wM6Gmfhkt3k6Cwp.jpg
Dirt (2018),"Poszukując liny ratunkowej dla swojej drużyny wyścigowej, mężczyzna bierze pod swoje skrzydła młodego złodzieja samochodów, szukającego drugiej szansy.",Film,Sportowy,2018,,6.4,32,USA,https://cda-hd.cc/29978/dirt-2018-online/,https://image.tmdb.org/t/p/w185/vTaCOiOHIizJcahCgRoBQWtDwsz.jpg
Terapia sercowa / Lasciati andare (2017),"Elia Venezia (Tony Servillo) to gburowaty psychoanalityk, który od paru lat żyje w separacji ze swoją żoną. Pewnego dnia dostaje diagnozę – jeśli nie zmieni swojego trybu życia, grozi mu poważna choroba. Postanawia zgubić parę kilogramów i wyrobić sobie trochę kondycję. W tym celu zapisuje się do Claudii (Verónica Echegui) – trenerki personalnej. Claudia to przeciwieństwo Elia. Mimo trudnej sytuacji życiowej, jest radosną osobą i pełną pozytywnej energii. Dziewczyna uwikłana jest w toksyczną relację z byłym partnerem, sama wychowuje też ich dziecko. Znajomość z dziewczyną odmienia życie psychoanalityka, który na nowo odnajduje światło w nudnej i przewidywalnej codzienności.",Film,Komedia,2017,,6.0,625,Italy,https://cda-hd.cc/33821/terapia-sercowa-lasciati-andare-2017-online/,https://image.tmdb.org/t/p/w185/2FC0JILDmLmJfAfjwdAPqS6KFon.jpg
Żadnych wątpliwości / Ôtez-moi d’un doute (2017),"45-letni wdowiec Erwan (François Damiens) jest ekspertem od rozminowywania i nagle odkrywa przez przypadek, że człowiek, który go wychował, nie jest jego biologicznym ojcem. Postanawia wynająć detektywa i rozpocząć poszukiwania swojego prawdziwego rodzica. Prawdopodobnie ojcem Erwana jest starszy, niezwykle ujmujący mężczyzna o imieniu Joseph (André Wilms), który znał jego matkę przez jakiś czas. Wdowiec jednocześnie poznaje Annę (Cécile de France), w której powoli się zakochuje. Wszystko wymyka się spod kontroli, gdy okazuje się, że jest ona córką Josepha, czyli jego przyrodnią siostrą.",Film,"Dramat, Komedia",2017,100,6.5,,"France, Belgium",https://cda-hd.cc/32331/zadnych-watpliwosci-otez-moi-dun-doute-2017-online/,https://image.tmdb.org/t/p/w185/13b26yIrgRFb9AOiwAngLtBgmwM.jpg
Kobieta z lodu / Ice Mother / Bába z ledu (2017),"Po śmierci męża Hana mieszka samotnie w rodzinnym domu. Jej dwaj dorośli już synowie odwiedzają ją wraz ze swoimi żonami i dziećmi, ale te wizyty na ogół kończą się kłótniami, więc atmosfera w rodzinie jest nie najlepsza. Kiedy Hana spotyka Bronę, twardego mężczyznę uzależnionego od pływania w morzu zimą, przed kobietą otwiera się nagle zupełnie nowy świat. Brona przyjmuje Hanę do swojego zespołu morsów, a ona stopniowo uczy się pokonać strach przed lodowatą wodą. Przede wszystkim jednak na nowo uczy się kochać…",Film,"Dramat, Komedia, Romans",2017,106,7.0,,"Czech Republic, France, Slovakia",https://cda-hd.cc/32327/kobieta-z-lodu-ice-mother-baba-z-ledu-2017-online/,https://image.tmdb.org/t/p/w185/xSVomaRhZW00gVTiWAHYFtkRGt.jpg
Labirynt świadomości (2017),Młoda dziennikarka prowadzi śledztwo w sprawie tajemniczych samobójstw. W jego trakcie wpada na trop firmy skupującej krew miesięczną.,Film,Thriller,2017,125,5.4,,Poland,https://cda-hd.cc/32263/labirynt-swiadomosci-2017-online/,"https://m.media-amazon.com/images/M/MV5BY2RkNjA3NjItNDVhNi00ZGZjLWFmZjktNGU3NjQzMGUyMGM5XkEyXkFqcGdeQXVyMTEwMTY3NDI@._V1_UY268_CR3,0,182,268_AL_.jpg"
